{
  "$schema": "https://json-schema.org/draft/2020-12/schema",
  "$id": "https://spa-platform.internal/contracts/platform-config.schema.json",
  "title": "Platform configuration",
  "description": "Settings the task environment supplies. They bound what any registry entry may say, so a registry writer cannot widen them. This schema describes the configuration in its JSON form, which is how the configuration binder sees it; the deployed form is environment variables, where a colon becomes a double underscore (Policy:AllowedUpstreams:0 is Policy__AllowedUpstreams__0) and every value arrives as a string that the binder converts. Source: docs/plan/02-contracts.md -> Platform configuration. Freezes at G1a.",
  "x-freeze": { "gate": "G1a", "status": "frozen-at-g1a" },
  "type": "object",
  "additionalProperties": true,
  "$comment": "additionalProperties is true because the task environment also carries settings that are not the platform's (Logging, ASPNETCORE_*, OTEL_*). Every section the platform owns is closed.",
  "required": ["Platform", "Registry", "Assets", "Issuers", "Policy", "ForwardedHeaders", "Session"],
  "properties": {
    "Platform": {
      "type": "object",
      "additionalProperties": false,
      "required": ["Cell"],
      "properties": {
        "Cell": {
          "$ref": "https://spa-platform.internal/contracts/registry.schema.json#/$defs/appId",
          "description": "The cell name. Part of every resource name and of the data-protection application name."
        }
      }
    },
    "Registry": {
      "type": "object",
      "additionalProperties": false,
      "required": ["Bucket", "Key", "PollSeconds"],
      "properties": {
        "Bucket": { "$ref": "#/$defs/bucketName" },
        "Key": {
          "type": "string",
          "minLength": 1,
          "pattern": "^[^/][^\\s]*$",
          "description": "The registry object's key, registry/registry.json in every environment so far."
        },
        "PollSeconds": {
          "type": "integer",
          "minimum": 1,
          "description": "The conditional-GET interval, jittered by up to 20%."
        }
      }
    },
    "Assets": {
      "type": "object",
      "additionalProperties": false,
      "required": ["Bucket"],
      "properties": {
        "Bucket": { "$ref": "#/$defs/bucketName", "description": "Where releases live. One bucket serves both in Phase 1." }
      }
    },
    "Issuers": {
      "type": "object",
      "minProperties": 1,
      "description": "The issuers a registry entry may name, keyed by the name an entry uses in oauth.issuer. Assumption A4 is one issuer per environment.",
      "propertyNames": { "$ref": "https://spa-platform.internal/contracts/registry.schema.json#/$defs/issuer" },
      "additionalProperties": {
        "type": "object",
        "additionalProperties": false,
        "required": ["Authority", "Profile", "BrowserOrigin"],
        "properties": {
          "Authority": {
            "type": "string",
            "pattern": "^https://[^\\s]+$",
            "description": "The issuer the OpenID Connect handler discovers from."
          },
          "Profile": {
            "type": "string",
            "enum": ["standard", "cognito"],
            "x-freeze": {
              "gate": "G1b",
              "status": "frozen-at-g1b",
              "note": "The key is frozen at G1a. The permitted IIdpProfile.Name values belong to G1b, recorded by the annotated contracts-v1 tag (ADR-0017)."
            },
            "description": "Which IIdpProfile applies. Set here, never in an entry."
          },
          "BrowserOrigin": {
            "type": "string",
            "pattern": "^https://[^\\s/?#]+$",
            "description": "The origin the browser visits at the provider: scheme and authority only. It goes into form-action and is the base of Cognito's logout URL."
          }
        }
      }
    },
    "Policy": {
      "type": "object",
      "additionalProperties": false,
      "required": ["AllowedHostSuffixes", "AllowedUpstreams"],
      "properties": {
        "AllowedHostSuffixes": {
          "type": "array",
          "minItems": 1,
          "uniqueItems": true,
          "items": {
            "type": "string",
            "minLength": 1,
            "pattern": "^[a-z0-9.][a-z0-9.:-]*$",
            "description": "A suffix a registry host may end with, lowercase, including the port when hosts carry one."
          }
        },
        "AllowedUpstreams": {
          "type": "array",
          "minItems": 1,
          "uniqueItems": true,
          "items": {
            "$ref": "https://spa-platform.internal/contracts/registry.schema.json#/$defs/api/properties/upstream",
            "description": "An upstream origin an entry may name. Phase 2 uses https patterns only."
          }
        }
      }
    },
    "ForwardedHeaders": {
      "type": "object",
      "additionalProperties": false,
      "required": ["TrustedNetworks"],
      "properties": {
        "TrustedNetworks": {
          "type": "array",
          "minItems": 1,
          "uniqueItems": true,
          "items": {
            "type": "string",
            "pattern": "^[0-9a-fA-F.:]+/[0-9]{1,3}$",
            "description": "The ALB subnets, in CIDR form. Applied to KnownIPNetworks; KnownNetworks is obsolete in .NET 10."
          }
        }
      }
    },
    "Session": {
      "type": "object",
      "additionalProperties": false,
      "required": ["Store", "MaxSessions"],
      "properties": {
        "Store": {
          "type": "string",
          "enum": ["memory", "dynamodb"],
          "description": "memory in Phase 1, dynamodb in Phase 2."
        },
        "MaxSessions": {
          "type": "integer",
          "minimum": 1,
          "description": "The bound on the in-memory store."
        }
      }
    }
  },
  "$defs": {
    "bucketName": {
      "type": "string",
      "minLength": 3,
      "maxLength": 63,
      "pattern": "^[a-z0-9][a-z0-9.-]*[a-z0-9]$"
    }
  }
}
