{
  "Platform": {
    "Cell": "poc"
  },
  "Registry": {
    "Bucket": "spa-platform-poc",
    "Key": "registry/registry.json",
    "PollSeconds": 15
  },
  "Assets": {
    "Bucket": "spa-platform-poc"
  },
  "Issuers": {
    "cognito-poc": {
      "Authority": "https://cognito-idp.us-east-1.amazonaws.com/us-east-1_EXAMPLE",
      "Profile": "cognito",
      "BrowserOrigin": "https://spa-poc.auth.us-east-1.amazoncognito.com"
    }
  },
  "Policy": {
    "AllowedHostSuffixes": [".spa-poc.test:8443"],
    "AllowedUpstreams": ["http://127.0.0.1:5080", "http://127.0.0.1:5081"]
  },
  "ForwardedHeaders": {
    "TrustedNetworks": ["10.20.0.0/16"]
  },
  "Session": {
    "Store": "memory",
    "MaxSessions": 10000
  }
}
